{
    "$schema": "src/schema/schema.json",
    "version": {
        "revision": 0,
        "patch": 0,
        "draft": 4
    },
    "editor": [
        "vscode"
    ],
    "license": {
        "year": "2022",
        "licensor": {
            "author": "Dwij Bavisi",
            "mail": "dwijbavisi@gmail.com"
        }
    },
    "runners": {
        "init": {
            "scripts": [
                "src/git/setup.sh",
                "src/editor/setup.sh"
            ]
        },
        "setup": {
            "scripts": [
                "src/editor/setup.sh"
            ]
        },
        "build-schema": {
            "scripts": [
                "build/schema.sh",
                "build/clean.sh"
            ]
        }
    }
}
